number,created_at,text,source,user is verified,user has url,user description,user created at,retweet_count,reply_count,like_count,quote_count,followers count,following count,tweet count,listed_count,user location,beto_flag,binary_class,ternary_class
8788,30/08/2022 13:29,"@JackPosobiec Well, a lot of homos are coming down with the Monkey Pox…..",Twitter for iPhone,FALSE,TRUE,"Senior Pastor of Truth Baptist Church, a new church plant in Suffolk, Virginia. ""Sanctify them through thy truth: thy word is truth."" John 17:17",01/07/2009 01:27,0,0,0,0,596,1100,27833,63,"Suffolk, VA",FALSE,1,1
7419,30/08/2022 15:03,"@JeremySWallace I heard Beto has monkeypox, is that true?",Twitter Web App,FALSE,FALSE,,27/04/2022 22:17,0,0,1,0,73,115,3252,8,None,TRUE,1,1
2992,30/08/2022 19:54,"@JordanSchachtel @BetoORourke Get well soon, monkeypox victim",Twitter Web App,FALSE,FALSE,,30/08/2022 00:46,0,0,1,0,13,328,33,0,None,TRUE,1,1
1080,30/08/2022 22:14,@kaveeta A person died from monkey pox. Don't let this happen to your niece. Do not take her to the pride event. It could be fatal.,Twitter for iPhone,FALSE,FALSE,"American who voted for Trump. New account. Yes, it's me. Formerly @RoadRunnerI80 and @RoadRangerI90 I am here to judge you. #Trump2024 #DeSantis2028",17/07/2022 04:30,0,0,0,0,33,38,2398,1,None,FALSE,1,1
6779,30/08/2022 15:43,@LinaHidalgoTX Then stop scaring people with the monkeypox or whatever new strategy from the government you have!!!:pouting_face::pouting_face::pouting_face:,Twitter for iPhone,FALSE,FALSE,"Skincare enthusiast! Defensora del Capitalismo, de las mujeres y los niños. Amante de mi México y orgullosa americana por adopción .:Mexico::United_States:",11/10/2020 19:12,0,0,5,0,145,397,4830,1,None,FALSE,1,1
5409,30/08/2022 17:07,@love_caravans @HumphreysJin As an unpaid carer I'm dreading what little wheeze the FM is gonna come up with next. Seeing as the monkeypox scare didn't have us all locking our doors. I'm going for a deadly mutated covid strain. What do you reckon?,Twitter for Android,FALSE,FALSE,If I don't like someone I don't follow them. I leave that to the trolls.,09/01/2014 23:09,0,1,3,0,86,88,15377,0,welshpool,FALSE,1,1
1137,30/08/2022 22:08,@MeanKeene @FoxNews Pretty gay that your thinking about gay sex hope u got ur monkeypox vaccine,Twitter for iPhone,FALSE,TRUE,Call me Chuck. Unvaccinated Patriot. 60 Years of age. Forklift certified. Back the blue. Come and take it. Semper Fi :United_States:. Hold the Line. Fake news Combatant.,21/11/2021 03:45,0,1,4,0,153,167,2522,2,The tavern,FALSE,1,1
12001,30/08/2022 03:33,@MetalPatriot76 @53wizard @judytgolf Betos got the infection passed by sodomy??! What's it called? Oh yeah… Monkey pox!!,Twitter for iPhone,FALSE,FALSE,"Husband, father, friend. Love my wife, kids, God and country. Trump defender and supporter.",01/11/2017 11:31,1,0,2,0,2559,2786,27494,4,"Georgia, USA",TRUE,1,1
8940,30/08/2022 13:16,"@modmothernature I don't have any personal experience in this matter, but I'm told the vast majority of those who have acquired monkeypox did so through anal sex with another male. Hey, I'm not judging. lol",Twitter Web App,FALSE,FALSE,"Constitutionalist; Divine Providence; I'm not paranoid, people only think I am; part owner of Spatula City; Beach Bum, Anna Maria Island; Native Floridian.",26/04/2022 13:11,0,0,0,0,394,812,2554,0,None,FALSE,1,1
1287,30/08/2022 21:56,@PamelaHensley22 I'm sure Beta is doing everything he can to increase his risk. Catching monkeypox is a pain is the ass - so he'd enjoy it.,Twitter Web App,FALSE,FALSE,"#1A, #2A, Bill of Rights, Constitution, and the Bible - great guidance for life. I teach - real academics - & do research. Pronouns: mene/mene/tekel/upharsin",08/06/2020 15:58,0,0,0,0,2002,1773,40633,0,USA,FALSE,1,1
11756,30/08/2022 04:01,@paulkidd We need to find out if this monkeypox is only happening in vaccinated individuals.,Twitter for Android,FALSE,FALSE,I'm a bitcoin maximalist that supports Litecoin. I got the money. I got the honeys.,10/07/2022 08:01,0,0,0,0,85,117,1026,2,None,FALSE,1,1
7371,30/08/2022 15:07,@ReutersFacts Aids or Monkey pox? Something transmitted by butt sex? :rolling_on_the_floor_laughing:,Twitter for Android,FALSE,FALSE,Sr.Automation Engineer (B.S. In BioMed Engineering and Biology) Dog Lover and Crypto Investor :dog:,11/10/2021 12:23,0,0,0,0,35,165,1110,5,United States,FALSE,1,1
8166,30/08/2022 14:13,"@ReutersFacts Before this Reuters ""fact check"", I put the possibility of O'Rourke having monkeypox at .1%. I now put it at 10%.",Twitter Web App,FALSE,FALSE,"Father, husband, senator, and Princeps. Loyal servant to the Empire.",03/09/2021 10:17,0,0,1,0,5,51,454,0,None,FALSE,1,1
2376,30/08/2022 20:31,@ReutersFacts Beto has Monkey Pox? Why am I not surprised.,Twitter Web App,FALSE,FALSE,"Dad, Husband, Brother. Patriot! Tangible assets includes 2nd Amendment and accessories. In my head. Who needs to drink when Reality will sober you up.",27/04/2022 13:23,0,0,0,0,78,75,3588,0,Anywhere I want to be.,TRUE,1,1
7796,30/08/2022 14:39,"@ReutersFacts LOL, so it was monkeypox then, because whatever the ""fact checkers"" say, believe the opposite.",Twitter Web App,FALSE,FALSE,"""It's usually futile to argue logic and facts with people who are enjoying a false sense of moral superiority in their ignorance."" -- Sowell",29/06/2017 23:27,0,0,0,0,331,178,39170,4,Somewhere in Volcano-ville.,FALSE,1,1
8308,30/08/2022 14:03,"@ReutersFacts OK, so Beto doesn't have monkeypox. Does his boyfriend?",Twitter Web App,FALSE,FALSE,"I love the USA and what it stands for. Do not let the dems destroy it. Dems, for God's sake, wake up to the lies. IFBAP #RedWave2022 #RonDesantis2024",24/02/2022 21:16,0,1,3,0,3400,4189,5236,2,None,TRUE,1,1
9258,30/08/2022 12:45,"@ReutersFacts Sounds like Betopox, which is related to Monkeypox as Doctorjill is related to medical practice.",Twitter for iPhone,FALSE,FALSE,,08/04/2011 18:33,0,0,1,0,479,2010,47569,24,"Washington, DC, USA",TRUE,1,1
3765,30/08/2022 18:56,@ReutersFacts What's that? Beto definitely doesn't have #monkeypox ? Okay. _URL_,Twitter for iPhone,TRUE,TRUE,Host of #Radical / #Bitcoin / GA Governor Candidate 2022 / Antiwar USMC Combat Vet / Libertarian /,14/03/2010 19:34,5,1,42,0,45480,2968,31576,144,Georgia,TRUE,1,1
10497,30/08/2022 09:14,"@rovercrc Nigga wtf are you talking about. You do realize that at least in the US, we're barely getting by anymore with how expensive things are getting? Unless I get a monkey pox stimmy check for taking it in the ass, I'm out of the market",Twitter for iPhone,FALSE,FALSE,$BTC will pay for my boob job,11/11/2021 02:01,0,0,1,0,19,82,1095,0,"Boulder, CO",FALSE,1,1
402,30/08/2022 23:18,"@SnackpaxEpi I would like to know how Monkeypox is spread. I thought it was transmitted by sexual contact, then I read reports that it was ""airborn"" a while ago1:face_screaming_in_fear: but now seeing only warnings about sexual transmission. Can someone enlighten me?",Twitter for Android,FALSE,FALSE,"Non Home owning baby boomer, Raging against the poisoning of our Planet, the poisoning of our Democracy, and the Betrayal of our Young.",18/08/2021 08:12,0,5,8,0,712,1148,4957,1,Rockhampton. Darumbal country,FALSE,1,1
606,30/08/2022 22:57,"@ssholesbegone @MrJ_20 @FoxNews I know this. However….Right now, monkey pox is primarily spread by the anal sex and those that partake in it, and then spread from there. Stop trying to justify gay orgies……:winking_face:",Twitter for iPad,FALSE,FALSE,"Lifelong educator, former democrat who saw the light. Now a strong conservative. Donald Trump is my President.",12/09/2021 21:56,0,3,1,0,1831,2058,36587,2,"Philadelphia, PA",FALSE,1,1
9118,30/08/2022 12:59,"@Supernova_Style @benryanwriter @NYC_stateofmind Monkeypox has a higher rate of sexual transmission (95%) than HIV, HepC, or HPV. This matters because as an STI, we can focus resources on sexual health, prevention, testing for other STI (many mpx folks are testing + for HIV and other STIs, so catching this is important). (2",Twitter Web App,FALSE,TRUE,Activist and writer of all things HIV adjacent. 2020 GLAAD Award winner and NLGJA's 'LGBTQ Journalist of the Year',19/01/2011 02:54,0,1,2,0,8756,2771,7685,168,"Atlanta, GA",FALSE,1,1
10419,30/08/2022 09:33,@Tazerface16 Anti-American Woke retired military coming out of the closet to join there Drag Antifa brethren. They like being in there underwear around little children. Here's hoping they all receive their monkeypox wish of being infected. _URL_,Twitter for iPhone,FALSE,FALSE,"JUDGE Blocked by Seth Abramson n Jennifer Cohn, 2 democrat fabricators who said they had proof of Russian collusion. Schiff nxt. some follow to hack :index_pointing_at_the_viewer: beware",02/04/2022 15:49,0,0,0,0,15,591,3967,0,None,FALSE,1,1
2350,30/08/2022 20:33,"@TwitterNYC Over 2 million Illegals are coming into our country every year. Many are NOT vaccinated &amp; can spread a variety of communicable diseases including: TB, COVID, polio, monkey pox, measles, encephalitis, etc. Thank you, Joe Biden!",Twitter Web App,FALSE,FALSE,,09/06/2022 19:22,0,0,0,0,1,1,7849,1,None,FALSE,1,1
2494,30/08/2022 20:26,"@WHCOVIDResponse Over 2 million Illegals are coming into our country every year. Many are NOT vaccinated &amp; can spread a variety of communicable diseases including: TB, COVID, polio, monkey pox, measles, encephalitis, etc. Thank you, Joe Biden!",Twitter Web App,FALSE,FALSE,,09/06/2022 19:22,0,0,0,0,1,1,7849,1,None,FALSE,1,1
12480,30/08/2022 02:24,@WokeLaugh @America1stMedia @BetoORourke MONKEY POX ... GUESS HE'S BATTING FOR THE OTHER TEAM NOW ...,Twitter for Android,FALSE,FALSE,Retired disabled Army veteran. Invited to Nam & Desert Storm. Parents were WW2 veterans. Family of flag waving patriots. If you don't love America. LEAVE IT .,19/03/2015 02:23,0,0,0,0,4240,5000,11489,2,El Paso TX Border,TRUE,1,1
11258,30/08/2022 05:34,@xeplusplus Not sure about this but the early symptoms of monkey pox is a pounding in the rear sensation.,Twitter for iPhone,FALSE,FALSE,"Colorado River, boating and off roading",21/02/2010 14:45,3,0,7,0,710,1266,1531,0,"Arizona, USA",FALSE,1,1
12503,30/08/2022 02:21,"#Breaking #BreakingNews Rumors fly that #Beto has #Monkeypox or #VAIDS from his 5 injections as is hospitalized. The UK health Security Agency earlier announced that 99% of the so branded monkeypox is among Trans, Gay, and Bisexual men &amp; hard to spread. _URL_",Twitter Web App,FALSE,TRUE,"News From The World's #1 Breakthrough CleanEnergy Innovator. The most BANNED Startup Founder in Human History. All Facts, all Scientific, all Truth. 4,726 techs",16/11/2021 11:56,0,2,2,0,1558,4759,5474,9,None,TRUE,1,1
3462,30/08/2022 19:17,Any truth to the rumor that Beto O'Rourke has monkeypox?,Twitter Web App,FALSE,FALSE,I'm a Cali conservative among a sea of WOKE idiots.,18/02/2022 04:24,127,246,800,25,54868,15392,1047,46,"Sherman Oaks, CA",TRUE,1,1
1733,30/08/2022 21:20,Beto got Monkeypox ROFLMAO.... :grinning_face_with_sweat::face_with_tears_of_joy::rolling_on_the_floor_laughing::rolling_on_the_floor_laughing::rolling_on_the_floor_laughing: _URL_,Twitter Web App,FALSE,FALSE,"Hello I new to Twitter I lika da MAGA & I Lika da WH40K, definitely not that NV legal guy he's an A-hole, Choctaw Indian.",13/01/2021 23:29,0,0,0,0,74,155,11952,1,Who cares...,TRUE,1,1
4845,30/08/2022 17:46,Beto has monkeypox. :rolling_on_the_floor_laughing::rolling_on_the_floor_laughing::rolling_on_the_floor_laughing::rolling_on_the_floor_laughing::rolling_on_the_floor_laughing: _URL_,Twitter Web App,FALSE,FALSE,Aerospace engineer. Colorado native. Balloon Pilot. Pronouns: Alpha/Butch :rainbow: :elephant:,11/12/2008 23:21,0,0,0,0,575,1892,9938,11,Denver CO,TRUE,1,1
9449,30/08/2022 12:20,Beto likes it in his butt &amp; he can not lie:eyes::face_with_tears_of_joy::face_with_tears_of_joy::face_with_tears_of_joy: #monkeypox,Twitter for Android,FALSE,FALSE,I am here for off color commentary. PRO LIFE. Probably a FED:eyes::face_with_tears_of_joy:,03/06/2021 00:26,0,0,3,0,6047,6404,37744,2,Alabama,TRUE,1,1
12381,30/08/2022 02:39,"Beto needs to stop ""riding the bike"" until the MonkeyPox is under control.  Beto O'Rourke Hospitalized During 5,600 Trek Across Texas - Cancels Live Campaign Events But Will Hold Virtual Rallies _URL_ via @gatewaypundit",Twitter for Android,FALSE,FALSE,,17/04/2022 14:55,0,0,0,0,9,272,293,0,None,TRUE,1,1
4402,30/08/2022 18:15,Beto O' Rourke has Monkeypox... especially now that the Fact-Checkers have confirmed it. By saying the total opposite of the truth... #BetoHasMonkeyPox _URL_,Twitter Web App,FALSE,TRUE,"Hi, I'm █████. A █████ sorts, who went to █████ and has been out of the █████. I love █████. :Statue_of_Liberty::United_States: #█████ #█████",26/04/2022 13:25,0,0,1,0,618,329,23461,0,█████,TRUE,1,1
4837,30/08/2022 17:47,Beto's got the MonkeyPox!,Twitter Web App,FALSE,FALSE,,25/12/2016 03:52,0,0,0,0,0,4,78,0,None,TRUE,1,1
4286,30/08/2022 18:22,Could monkeypox be a side effect of the :syringe: _URL_,Twitter for iPhone,FALSE,FALSE,Just a citizen,04/10/2021 21:53,0,0,0,0,44,199,2482,0,None,FALSE,1,1
7581,30/08/2022 14:53,Did @BetoORourke really get MonkeyPox :rolling_on_the_floor_laughing::rolling_on_the_floor_laughing::rolling_on_the_floor_laughing::rolling_on_the_floor_laughing::rolling_on_the_floor_laughing:.,Twitter for Android,FALSE,FALSE,"U.S. Army, Married,#NM #Pro2A. #1A, Need to turn NM RED. NO DM's unless Approved first. :lizard::lizard::lizard:",08/06/2022 22:48,0,0,0,0,426,703,3129,1,"New Mexico, USA",TRUE,1,1
9192,30/08/2022 12:52,"Does Beto have Monkeypox, or just Monkeyface",Twitter Web App,FALSE,FALSE,A persons perception is their reality. The ability to understand this about ones self and others is sadly a limiting factor many times in our lives.,20/11/2014 13:54,0,2,4,0,1252,2398,19569,2,Energy Corridor Texas,TRUE,1,1
8843,30/08/2022 13:23,FACT-CHECK: Beto did not contract monkeypox from that gay orgy on the campaign trail • Genesius Times #factcheck #BetoHasMonkeyPox #BetoforGovernor2022 #pride _URL_,Twitter Web App,FALSE,FALSE,The most reliable source of fake news on the planet. Period. _URL_,26/08/2019 12:58,1,0,3,0,973,940,6177,11,None,TRUE,1,1
8593,30/08/2022 13:43,How'd Beto catch monkeypox? _URL_,Twitter for iPhone,FALSE,FALSE,"Stoic, advocate for peace, civil discussion, and non-violence. Catholic. Peddler of opinions, scientific articles, facts and art, and animal videos.",10/02/2009 02:59,0,0,0,0,341,909,29722,7,"Olympia, WA",TRUE,1,1
2269,30/08/2022 20:38,I saw the Butthole Surfers were trending and I thought they had monkeypox. _URL_,Twitter Web App,FALSE,FALSE,Shitposter extraordinaire | Wannabe memelord | Recalcitrant | Anarchist | Menace to your Society:trade_mark:,13/07/2022 12:20,0,0,2,0,86,116,2598,1,Fuckoffistan,FALSE,1,1
12862,30/08/2022 01:27,"If we're really under siege of biowarfare, globally, don't you think it's time governments start admitting this to us? Seriously a case of monkey pox in a Georgia Elementary school today",Twitter for iPhone,FALSE,FALSE,"#1312Project is dedicated to highlighting police perpetrated crimes, abuse & neglect against citizens. Follow me so I can see political news Republikkans Suck",13/06/2022 02:14,0,0,0,0,823,1088,2639,1,Followed by Ken Russell,FALSE,1,1
9704,30/08/2022 11:49,Is it true that @BetoORourke has Monkeypox?,Twitter Web App,FALSE,FALSE,"Husband, Father, 7th consecutive generation farmer. Farm in a place I like to call Alkali Flats. The soil's not good, but the weather's bad.  LEAD XXV",16/02/2009 13:18,0,0,0,0,445,616,5302,8,David City,TRUE,1,1
10243,30/08/2022 10:18,Is monkeypox a sexually transmitted disease? How do children get it? _URL_,WordPress.com,FALSE,FALSE,sport,07/08/2022 12:39,0,0,0,0,2,6,5758,0,None,FALSE,1,1
11701,30/08/2022 04:09,Is monkeypox a sexually transmitted disease? How kids get it _URL_,WordPress.com,FALSE,TRUE,"Dear, since you have reached my page, I hope you will follow me, if you do not mind :slightly_smiling_face::orange_heart:",27/03/2022 22:57,0,0,0,0,29,37,109936,1,United States,FALSE,1,1
13214,30/08/2022 00:40,Isn't Monkey Pox a bacterial infection? _URL_,Twitter Web App,FALSE,FALSE,"Not woke. Quite sane. My gender is obvious. #MAGA, Pro #2ndAmendment. Homesteader. Former NPS Backcountry Ranger. Live Free or Die. Live Dangerously.",05/10/2014 16:41,0,0,0,0,1897,3251,52668,7,"Carthage, TX",FALSE,1,1
3173,30/08/2022 19:38,"LA County really said ""Monkeypox isn't just a gay disease. It affects whores of all genders!"" _URL_",Twitter for iPhone,FALSE,TRUE,Bad Bitch. :television: & :movie_camera: writer - S2 @wokehulu & @QueensABC. Actor. Sex educator & survivor advocate. Abolitionist. Mgmt: Echo Lake :Trinidad_&_Tobago::rainbow_flag: she/her,06/07/2012 17:24,2,2,43,0,11224,1194,18115,69,CHI/LA/shopping with ur daddy,FALSE,1,1
4140,30/08/2022 18:32,Looks like a lot of butt fuckers are getting Monkey Pox,Twitter for iPhone,FALSE,FALSE,,20/02/2009 04:48,0,0,1,0,19,24,908,0,lashwhip@yahoo.com,FALSE,1,1
1368,30/08/2022 21:50,Media Wants You To Stop Talking About Beto O'Rourke's Monkeypox _URL_ via @YouTube,Twitter Web App,FALSE,FALSE,"Former LE , consumater of marriages , wearer of loin cloth's , lover of the .41 magnum , conservative , NRA , 111 % , holder of the big nose and hairy ass .",12/01/2021 21:48,1,0,0,0,1598,2949,10373,3,None,TRUE,1,1
1131,30/08/2022 22:09,Media Wants You To Stop Talking About Beto O'Rourke's Monkeypox _URL_ via @YouTube,Twitter Web App,FALSE,FALSE,,22/03/2022 23:52,0,0,0,0,125,384,2617,1,None,TRUE,1,1
1077,30/08/2022 22:14,Media Wants You To Stop Talking About Beto O'Rourke's Monkeypox _URL_ via @YouTube,Twitter Web App,FALSE,FALSE,i am a bum,21/10/2021 22:45,0,0,1,0,168,238,1174,1,None,TRUE,1,1
11546,30/08/2022 04:39,monkey pox is a fake disease created by the left to get more attention to gay people _URL_,Twitter for iPhone,FALSE,FALSE,,31/05/2021 22:29,0,1,1,0,74,190,5446,1,She Her,FALSE,1,1
7232,30/08/2022 15:15,monkeypox got it the old fashioned way using his bum instead of his brain _URL_,Twitter Web App,FALSE,FALSE,oracle and blacksmith,01/06/2022 16:20,0,0,0,0,6,39,469,0,None,FALSE,1,1
1096,30/08/2022 22:11,"Now scaring people into thinking that Monkey pox is now killing you, so you better get jabbed quick. May the Most High God destroy this nasty virus, so those who are in wicked control can no longer have a reason to jab with their mixture. #NewsAlert",Twitter for Android,FALSE,FALSE,Inform and BE informed!,09/02/2022 02:14,0,1,0,0,16,26,631,0,United States,FALSE,1,1
9995,30/08/2022 11:10,"Of course its Convid19 related! Poor guy, VAIDS, c19 and Moneypox all at the same time! Wow! I've seen the jabbed's future.  _URL_",Twitter for Android,FALSE,FALSE,Here for the Awakening! For some truth!For Disclosure! For the trafficked children and to SHINE a :bright_button: on corruption. Let's kick 'em in the Ka'balls!! :hear-no-evil_monkey::see-no-evil_monkey::speak-no-evil_monkey: #KBF,14/07/2014 22:15,0,0,0,0,427,645,8966,1,London via South Africa,FALSE,1,1
4293,30/08/2022 18:22,One day after pledging $11 million into monkey pox :syringe: by amazing coincidence the first death occurs :see-no-evil_monkey::face_with_tears_of_joy: _URL_,Twitter for iPhone,FALSE,FALSE,I've just visited the future & it is a Satanic centralised global fake health government ruling a slave race of half cyborg humans. We need to fix it in 2022 :latin_cross:,04/02/2022 21:58,2,1,5,0,679,680,4751,1,:clown_face::ringed_planet:,FALSE,1,1
2879,30/08/2022 20:01,"Reuters felt the need to do a ""fact check"" saying that Beto O'Rourke does NOT have monkey pox. That makes me think Beto O'Rourke may have monkey pox.",Twitter Web App,FALSE,FALSE,"Christian. Retired cop, retired lawyer. Trying to be a good man in a wicked and insane world. PRONOUNS: Ni / Ekke Ekke Ekke Ekke Ptang Zoo Boing!",28/04/2022 02:10,7,0,17,0,143,158,155,1,None,TRUE,1,1
1805,30/08/2022 21:14,"So, Beto O'Rourke has Monkeypox? I think I just won Monkeypox Bingo. #BetoHasMonkeyPox",Twitter Web App,FALSE,FALSE,Christ :latin_cross: :black_small_square: Family :family_man_woman_girl_boy: :black_small_square: I am third. :man_light_skin_tone: Conservative with a libertarian streak. #LGM #TakeFlight,03/03/2022 16:05,0,0,0,0,169,938,2292,1,"Florida, USA",TRUE,1,1
5954,30/08/2022 16:30,"Such easy money it becomes addictive, let's push MonkeyPox campaigns now. Straight Money..... We can name COVID strands like they name hurricanes. What's coming this flu season? ""Toronto-Saurous-Rex""strand found in Canada? _URL_",Twitter for Android,FALSE,TRUE,_URL_,31/07/2016 01:18,0,0,0,0,852,983,16510,27,None,FALSE,1,1
5123,30/08/2022 17:28,"This is where Monkeypox started. It was probably the post-event orgy, but I could be wrong. _URL_",Twitter Web App,FALSE,FALSE,Planned Parenthood's favorite snack.,25/07/2014 23:19,0,0,0,0,92,418,24774,1,Poland,FALSE,1,1
11714,30/08/2022 04:08,This requires DEEP THOUGHT because leftist NPR wants to keep your pets safe from monkeypox...My understanding is that there's one way to get monkeypox. :thinking_face: I don't think your pet needs the jabby-jab. Your pet needs you to REFRAIN from the other jabby-jab! _URL_,Twitter Web App,FALSE,TRUE,We're the happiest preppers on the planet! #MAGA #UltraMAGA #NuclearMAGA,09/05/2022 01:37,1,0,3,0,2421,2407,4523,6,Happiest Place on Earth,FALSE,1,1
12412,30/08/2022 02:35,"Well this guy definitely has ""monkeypox"" from being gay. _URL_",Twitter for Android,FALSE,FALSE,Home to Roost,11/02/2022 09:43,0,0,0,0,85,100,2732,0,"Sacramento, CA",FALSE,1,1
4508,30/08/2022 18:08,Word is Beto has monkeypox! :astonished_face: _URL_,Twitter for iPad,FALSE,FALSE,":backhand_index_pointing_right:Trump won:backhand_index_pointing_left: Cry more, Libs. Gettr and TRUTH (@redco), Gab (@redco_). #LGBFJB #YesToMeat :cut_of_meat:",16/06/2009 05:10,0,0,0,0,2447,3997,62192,23,Free America,TRUE,1,1
5847,30/08/2022 16:37,"""After Banu and her family survived smallpox, the rest of the world dried its hands in the dirt—just as it appears poised to do for the poorest victims of COVID-19 and now monkeypox."" _URL_",TweetDeck,TRUE,TRUE,@politico health care reporter covering the states | proud @thenvindy alum | @ucberkeley grad | california born + raised | home still means nevada,26/06/2011 03:51,1,1,7,0,30909,1470,26732,733,"Washington, DC",FALSE,0,9
6504,30/08/2022 16:00,"""I'm sorry, but calling Monkey Pox the 'pandemic of the unvaginated' is probably the funniest thing I've ever heard in my life."" —Very Swell Nice Guy",Twitter Web App,FALSE,TRUE,"MAGA Retired graphic designer and former U.S. Marine, happily married and living in Myrtle Beach, SC.",22/10/2008 01:52,0,0,0,0,7834,8600,55925,225,"Myrtle Beach, South Carolina",FALSE,0,9
8118,30/08/2022 14:17,"""My hunch was that it's not 1983 any more, and that straight talk (no pun intended) to gays about the risks of Monkeypox would not summon forth an ideological reaction."" One would hope so but these are extremely ideology-driven times. _URL_",Twitter Web App,FALSE,FALSE,I observe and comment. RTs are not necessarily endorsements. Those who resort to name-calling have conceded the point; discussion has ended. 13013B on GETTR.,01/12/2012 22:14,0,0,0,0,527,505,87231,16,"Columbus, Ohio",FALSE,0,9
13287,30/08/2022 00:31,"""We propose a classification of #MPXV that is nondiscriminatory, non-stigmatizing &amp; aligned w/best practices in naming of infectious diseases...minimizes negative impacts on nations, geographic regions, economies &amp; people..."" #monkeypox  _URL_",Twitter Web App,TRUE,TRUE,"Former Sr Fellow @CFR_org. Recipient of Pulitzer Prize, Polk (2Xs) and Peabody Awards. Author: IHeard theSirensScream, TheComingPlague, Ebola & BetrayalofTrust.",15/05/2011 20:00,8,3,34,0,257643,1857,89414,4880,"New York, NY",FALSE,0,9
10219,30/08/2022 10:24,"[Stigmabase UK] Controversial radio host condemned for calling MPXV 'the big gay disease': A controversial Australian radio show host has been criticised for his ""appalling"" words after saying only ""the gays"" get monkeypox.  View article... _URL_",dlvr.it,FALSE,TRUE,Nordic Xperience Team: UK — Ireland — Scotland — Inuit — Svenska — Norsk ... | Fighting stigma | A Canadian Non-Governmental & Nonprofit In,15/09/2010 15:55,0,0,0,0,1626,1291,967804,111,Ireland | Scotland | Inuit | Skandinavien,FALSE,0,9
9634,30/08/2022 11:57,"@_David_Edward @TheH2 The best fact check ever was them saying that no, it was not monkeypox.",Twitter Web App,FALSE,TRUE,Have a nice day.,01/08/2009 19:12,0,0,4,0,1050,234,92246,40,Chicago,FALSE,0,9
5754,30/08/2022 16:43,@222Earthbaby @Wonky__Wook Also don't believe everything you read! That's so dangerous :( I'm not an expert but an infectious disease doctor came to my work to do a lecture about monkey pox. I have confidence that my knowledge is more reliable than most stuff you read :/,Twitter for iPhone,FALSE,TRUE,"Dubstep loving, pickle obsessed, head banging, nurse. :Taurus: :SOON_arrow: LL :T-Rex: :SOON_arrow: Wobbleweeeen :jack-o-lantern: Rent camping gear for LL with link down below!!! :tent:",04/09/2015 14:15,0,0,0,0,640,365,11194,0,"Columbus, OH",FALSE,0,9
719,30/08/2022 22:45,"@adtom71 Thanks for your concerns but as a sex worker, I'm quite knowledgeable about sex health and I'm responsible for my own actions. Plus, I've already had the monkey pox.",Twitter for iPhone,FALSE,TRUE,+18 | vers power slut :ogre: backup: @lucasmorenxx,02/05/2020 20:27,0,0,1,0,46714,348,5198,140,"Barcelona, Spain",FALSE,0,9
