number,created_at,text,source,user is verified,user has url,user description,user created at,retweet_count,reply_count,like_count,quote_count,followers count,following count,tweet count,listed_count,user location,beto_flag,binary_class,ternary_class
3047,30/08/2022 19:51,_URL_ Texas health officials on Tuesday reported an immunocompromised patient with monkeypox has died. This would be the first known death from the virus in the Unit...,Twitter for Android,FALSE,FALSE,You can only turn the other cheek so many times...before you start spitting out teeth! R.P.:blue_heart::blue_heart:,10/06/2019 23:56,0,0,0,0,3377,4911,36196,2,TEXAS,FALSE,0,0
10879,30/08/2022 07:10,:backhand_index_pointing_left:主页主页 Monkeypox Houston: IDEA Hardy campus and Ridge Point High School in Fort Bend ISD report separate cases - KTRK-TV: Monkeypox Houston: IDEA Hardy campus and Ridge Point High School in Fort Bend ISD report separate cases KTRK-TVView Full Coverage on Google News _URL_,dlvr.it,FALSE,FALSE,稀有优质资源:backhand_index_pointing_right:电报群 _URL_,16/08/2022 08:54,1,0,0,0,3,0,1075,0,None,FALSE,0,0
5545,30/08/2022 16:59,:flushed_face::flushed_face::flushed_face::flushed_face:Texas Confirms First Death of a Person with Monkeypox _URL_,Twitter for iPhone,FALSE,FALSE,"A safe space for gay,queer,bi,and sex positive Blk Guys. #BRfreak #HTXfreak #504freak #225Freak #BatonRougefreak #NOLAFreak #HoustonFreak #ATLFreak",14/04/2018 15:25,0,0,0,0,388,217,850,1,None,FALSE,0,0
4916,30/08/2022 17:42,:pushpin:BREAKING NEWS:police_car_light: The Texas Department of State Health Services (DSHS) confirms that a Harris County Texas resident died with monkeypox. @KABBFOX29 @News4SA _URL_,Twitter for iPhone,TRUE,FALSE,Anchor-Reporter /WOAI News 4 /KABB Fox 29 / _URL_ / _URL_ / News Tip? Email: Darian@News4SA.com,16/04/2009 17:13,0,0,0,0,1622,304,3614,47,"San Antonio, TX",FALSE,0,0
2863,30/08/2022 20:02,.@NFPMedCenter is hosting a Monkeypox vaccine clinic on Friday in @LakewoodOhio.  To learn more/sign-up: _URL_,Twitter for iPhone,FALSE,TRUE,"Treuhaft Chair/Sr. Fellow @communitysols. Lecturer @OUHCOM. MCAC, OH. @MayDuganCenter, @MagnoliaCHouse, @betterhealthcle. MBA, CSSGB. @lscohio alum. Medicaid.",17/05/2009 05:49,4,0,5,0,2245,3340,17065,37,"Cleveland, OH",FALSE,0,0
3867,30/08/2022 18:50,""" Officials are investigating what role monkeypox played in the death. They said the patient, who was an adult and a resident of Harris County, Texas, was 'severely immunocompromised' but didn't offer additional details."" _URL_",Twitter Web App,FALSE,FALSE,ᗰᗩIᑎTᗩIᑎ TᕼE ᖇᗩGE _URL_,09/01/2022 06:45,3,1,2,0,5089,288,8853,24,None,FALSE,0,0
11146,30/08/2022 06:03,"""Health experts explain the difference between monkeypox and COVID-1... - japhethz409@gmail.com - Gmail _URL_",Twitter Web App,FALSE,FALSE,,29/08/2022 08:42,0,0,0,0,0,17,1,0,None,FALSE,0,0
2054,30/08/2022 20:55,"""Patient was severely immunocompromised"" -Texas state confirms first US death from monkeypox outbreak _URL_ _URL_",LIB App,FALSE,TRUE,"Blogger. CEO, LindaIkejiTV",29/03/2009 23:14,1,0,6,0,1863092,1042,229260,1615,Lagos,FALSE,0,0
2429,30/08/2022 20:29,(Montreal public health probing 'probable' monkeypox case involving child – EverythingGP) has been published on The Globe - _URL_,theglobe.co.com,FALSE,FALSE,,02/03/2022 07:31,0,0,0,0,11,1,104738,0,None,FALSE,0,0
3763,30/08/2022 18:56,(Texas confirms 1st monkeypox death; could be 1st in US – KMID – Local 2 News) has been published on The Globe - _URL_,theglobe.co.com,FALSE,FALSE,,02/03/2022 07:31,0,0,0,0,11,1,104738,0,None,FALSE,0,0
11180,30/08/2022 05:57,"@Addy08015969 @KPRC2 I hope you know how stupid you sound. GAY MEN are not the only people who can get monkeypox. It can be contracted from basic skin contact, touching surfaces that have come in contact with those that have it, even something as simple as a door handle or money. Schools have a large",Twitter for Android,FALSE,FALSE,,18/04/2018 02:24,0,1,1,0,102,495,4939,0,None,FALSE,0,0
8597,30/08/2022 13:42,@findmeabluebird @_TheAncientOne_ @LizHighleyman @WHO @CDCgov Airborne transmission of Monkeypox only occurs with long exposures &amp; under rare circumstances. Monkeypox is mostly transmitted via direct/prolonged contact with an infected individual. 1/,Twitter for iPhone,FALSE,FALSE,A bus driver who has opinions,03/09/2012 16:53,0,2,1,0,52,180,10813,1,"Port Moody, British Columbia",FALSE,0,0
9136,30/08/2022 12:57,@googlespixel Monkeypox is a viral infection so… no,Twitter for iPhone,FALSE,FALSE,Proud educator & activist fighting 4 schools & fair treatment of all the worlds citizens. vaccine advocate and education advocate,07/04/2012 15:13,0,0,0,1,491,893,31639,7,None,FALSE,0,0
1639,30/08/2022 21:27,"@HdsnVlyAuthor ""Zoonotic"" just means an infection that can be transmitted from animals to humans--that doesn't mean it's bacterial. Monkeypox is zoonotic, but viral, NOT bacterial.",Twitter Web App,FALSE,FALSE,Justice--and health care--for all.,17/08/2014 18:18,0,0,0,0,790,1463,27177,17,DMV,FALSE,0,0
12946,30/08/2022 01:17,@iamguidodavid .@iamguidodavid: 'Yung fourth (monkeypox) case likely to be local transmission.,Twitter Web App,TRUE,TRUE,"The official Twitter account of Super Radyo DZBB 594 kHz, the flagship AM radio station of GMA Network, Inc.",12/01/2012 08:18,1,0,2,0,242998,947,679195,774,Republic of the Philippines,FALSE,0,0
8975,30/08/2022 13:12,"@ING2Firebrand Monkeypox is viral, not bacterial.",Twitter for Android,FALSE,TRUE,"Ingénieur en circulation hérétique, intérêt pour l'urbanisme et nationaliste québécois. Heretical traffic engineer, interest for urbanism, Québec nationalist.",08/03/2012 00:38,0,0,0,0,1165,158,14477,26,Québec,FALSE,0,0
8587,30/08/2022 13:43,@SandyBeachesFJB Monkey pox is not a bacterial infection,Twitter for iPad,FALSE,FALSE,,26/04/2022 15:13,0,0,0,0,7,9,298,0,None,FALSE,0,0
9958,30/08/2022 11:15,"@yael_furman Yes, there were reports of a 3rd death and it was confirmed it wasn't due to monkeypox and as a result it was removed.",Twitter for iPhone,FALSE,TRUE,Live updates on the Monkeypox outbreak and case count around the world :globe_showing_Americas: Support us- _URL_,09/08/2018 12:08,0,1,2,0,32231,20,1973,252,"Miami, FL",FALSE,0,0
5244,30/08/2022 17:18,"@Your_UIU_Agent @reddit_lies It spreads through contact, like brushing against open sores, you can't fling monkeypox out of your banana",Twitter Web App,FALSE,TRUE,aequatis mendacium _URL_,21/05/2010 17:48,0,4,4,0,221,273,7666,1,Inside a chocolate bar wrapper,FALSE,0,0
13280,30/08/2022 00:32,"#BREAKING: Harris County investigating whether monkeypox caused patient's death. If it did, this would be the first mpx death in the U.S.  Patient also had ""various severe illnesses.""  _URL_ via @houstonchron",Twitter Web App,TRUE,TRUE,Health reporter @houstonchron. Writing. Running. Music. SA Spurs. News tips? julian.gill@chron.com,24/12/2011 14:18,10,0,8,0,3582,1327,8625,76,"Houston, TX",FALSE,0,0
2476,30/08/2022 20:27,"#Monkeypox | The virus has mostly spread among men who have sex with men, but anyone can get it through close, direct contact with an infected person. #Texas #USA #MonkeypoxVirus #UnitedStates #WHO #Iran #Indonesia #TedrosAdhanom #Europe _URL_",Twitter Web App,TRUE,TRUE,"Follow _URL_ for breaking news from India and around the world, cricket updates, Bollywood gossip, travel tips and more | Zee Media",04/03/2009 16:20,0,0,1,0,28118,877,258778,307,India,FALSE,0,0
7682,30/08/2022 14:47,#monkeypox death #Texas dept of health: first death of a person diagnosed with monkeypox—patient was severely immunocompromised. _URL_,Twitter for iPhone,TRUE,TRUE,Internl TV Correspondent with Voice of America--looking worldwide for the next gr8 news story and adventure. I love homemade Gnocchi & blk and white schnoodles.,10/10/2011 22:48,1,0,0,0,2847,798,1437,53,"Washington, DC",FALSE,0,0
9793,30/08/2022 11:37,"#Monkeypox does not present the same level of threat as #COVID19, but it is still a major #publichealth problem, with more than 44,000 cases reported in at least 99 countries since the beginning of 2022. The majority of #MPX cases have been reported in th…_URL_",LinkedIn,FALSE,TRUE,"Group Chief Medical Officer, St Vincent's Health Australia & Professor at Monash University, University of Melbourne & Macquarie University",15/08/2009 12:48,1,0,0,0,1216,5,10299,16,"Melbourne, Victoria",FALSE,0,0
9879,30/08/2022 11:25,"#MonkeypoxVirus #MonkeyPox Aug 30, FIRST report. Cases 59,130 (50,547 confirmed) Deaths 117 [9 outside Africa]. USA 18,669 (18,621 c.) Update: Colombia +309(582), Ecuador +16(52), Ireland +16(144), Sweden +2(156), Florida +43(1,913). New death in Brazil. _URL_",Twitter Web App,FALSE,FALSE,Born 3400 BC the first time.,01/11/2020 19:44,0,1,0,0,55,14,12072,1,"New York City, New York, USA",FALSE,0,0
2857,30/08/2022 20:03,"#newsupdate White House, Louisiana gear up to fight monkeypox ahead of massive Southern Decadence festival Read the news #TopStories from Adele Kenny by visiting the link _URL_  #newsnight #newsalert #newsupdates #newszero #newshot #newsconnect",Raja News,FALSE,TRUE,RAJACREATOR is the largest English-language news media company that focuses on Asia.,13/03/2022 14:13,0,0,0,0,17,1,47414,0,None,FALSE,0,0
1192,30/08/2022 22:03,#うひーメモ 投稿時間:2022-08-31 07:03:34 First US death linked to monkeypox reported in immunocompromised adult in Texas _URL_ #海外TECH,uhiiman_bot,FALSE,TRUE,こんにちわうひーマンです。 本体は↓コイツです。 _URL_ すでに読んだ記事や後で読もうと思った記事なんかをストックしている場所です。24時間フル稼働しています。 人ではありませんので、悪しからず。,29/02/2020 04:22,0,0,0,0,266,758,759662,6,None,FALSE,0,0
12828,30/08/2022 01:31,☆ College campuses across the nation are preparing for monkeypox ahead of the fall #BreakingNews #cbsnews :airplane::airplane::airplane: _URL_ _URL_,dlvr.it,FALSE,TRUE,"JavaScript, HTML5 & CSS3 develiper & trainer. Listen this before job interview to speed your mind: _URL_",17/02/2011 18:37,0,0,1,0,6455,7100,133793,386,world,FALSE,0,0
3565,30/08/2022 19:10,10 key questions about monkeypox the world needs to answer _URL_,WordPress.com,FALSE,TRUE,Afpkudos News Editor and Writer @afpkudos_com,10/06/2022 01:29,0,0,0,0,8,5,21669,0,United States,FALSE,0,0
8254,30/08/2022 14:08,10 key questions about monkeypox the world needs to answer _URL_ via @statnews,Twitter for iPhone,TRUE,TRUE,National Association of County and City Health Officials (NACCHO) is the national organization representing local #publichealth departments. RTs ≠ endorsements.,18/04/2009 09:26,0,0,1,0,28216,3454,39796,744,"Washington, DC",FALSE,0,0
10023,30/08/2022 11:07,3 children in Georgia test positive for monkeypox _URL_ CDC/FDA/WHO/COVID-19/Elizabeth Warren/Mike Bloomberg/Kamala Harris/Cory Booker/PPE/N95/NHS/NIH/Bernie Sanders/Tulsi Gabbard/Pete Buttigieg/Andrew Yang/Julian Castro/Gretchen Whitmer/Kathy Hochul/Eric Adams,Twitter Web App,FALSE,TRUE,ポンコツヘタレマンでーす( ' ▽ ' )ﾉ 単なるメモなので特に意味は無いです:smiling_face: 元おねんどお姉さん。「ハズキルーペの呪い」発売中! ※すべてフィクションです,29/07/2019 00:47,0,0,0,0,37,9,9971,4,危険な通学路～魔の交差点,FALSE,0,0
3285,30/08/2022 19:30,5 significant developments to #monkeypox testing your #clinicallab should be aware of. Read more :right_arrow: _URL_ _URL_,HubSpot,FALSE,TRUE,"Useful business and management intelligence for laboratory managers, pathologists and diagnostic executives: clinical pathology intelligence, webinars, & more!",03/06/2009 23:02,0,0,0,0,4172,2003,2323,125,"Austin, Texas",FALSE,0,0
4867,30/08/2022 17:45,"A @CDCgov spokesperson confirms that in the U.S. ""This is the first death in an presumed positive for monkeypox that we are aware of."" Similar to @hcphtx, adds that  ""it is premature to assign a specific cause of death."" _URL_  _URL_ _URL_",Twitter Web App,TRUE,TRUE,"Reporting on COVID-19 and some other public health topics for @CBSNews in DC. Email TinA@CBSNews.com, call 202-381-7107, or DM for @signalapp number! He/him.",20/07/2012 05:03,0,0,0,0,6255,6539,17319,223,"Arlington, VA",FALSE,0,0
11375,30/08/2022 05:11,A dog caught monkeypox. What does it mean for our pets and other species? _URL_ via @NatGeoMag,Twitter Web App,FALSE,TRUE,"LadySoldier, Mom, Atheist, former army wife & repub. Church/State Separation #stopthepatriarchy _URL_",23/08/2011 02:27,0,0,1,0,447,1576,17354,9,Colorado,FALSE,0,0
10897,30/08/2022 07:05,"A dog in France has monkeypox, worrying scientists that we won't be able to eradicate the virus if it spreads to more animals _URL_",Twitter Web App,FALSE,FALSE,Trump Lost. Rebuilding after Twitter's crap algo misfired on sarcasm yet again.,23/10/2015 03:51,0,1,0,0,235,431,990,0,"If you know, you know.",FALSE,0,0
3292,30/08/2022 19:30,A Durham company has landed a $680 million contract to supply the U.S. with a drug that could be used to fight the monkeypox outbreak. _URL_,True Anthem,FALSE,TRUE,"The latest business news from the Triad Business Journal, covering Greensboro, Winston-Salem, High Point and the 12-county Triad area.",18/02/2009 17:39,0,0,0,0,13544,610,52008,350,Greensboro/Winston-Salem,FALSE,0,0
4641,30/08/2022 18:00,A new vaccination method could greatly increase the number of doses available as South Carolina seeks to halt the spread of monkeypox among the highest-risk groups in the state. _URL_,True Anthem,TRUE,TRUE,"The Herald in Rock Hill provides news from York, Chester and Lancaster counties.",20/08/2009 14:28,0,0,0,0,17224,228,41137,0,"Rock Hill, S.C.",FALSE,0,0
5090,30/08/2022 17:30,"A person in Texas who was diagnosed with monkeypox and had a weak immune system has died, Texas state health officials said, in what could be the first-known fatality from the virus in the U.S. _URL_",SocialFlow,TRUE,TRUE,Sign up for our newsletters and alerts: _URL_ For WSJ customer support: _URL_,01/04/2007 06:22,39,14,63,5,20134612,1077,382197,126791,"New York, NY",FALSE,0,0
12464,30/08/2022 02:27,"After a bungled start, monkeypox vaccination is still hitting hurdles. It may be time for the U.S. to start considering an older, riskier shot that the country has stockpiled in spades, @KatherineJWu reports. _URL_",SocialFlow,TRUE,TRUE,"Exploring the American idea through ambitious, essential reporting and storytelling. Of no party or clique since 1857. _URL_",27/04/2009 15:41,3,4,13,0,2158495,1079,210450,30969,None,FALSE,0,0
2901,30/08/2022 20:00,An examination of some of the most pressing questions about #monkeypox from @MeganMolteni @HelenBranswell @DrewQJoseph and @Jasonmmast _URL_,Buffer,TRUE,TRUE,Reporting from the frontiers of health & medicine.  Sign up for any of our 10 free newsletters here: _URL_,24/07/2015 16:09,2,1,4,0,167971,5158,59484,4434,None,FALSE,0,0
205,30/08/2022 23:36,Appreciate Noah Weiland ⁦@nytimes⁩ including my comments on this important story on ⁦@POTUS⁩ Admin efforts to address disparities in #monkeypox  #healthequity  ⁦@JHhealthequity⁩ _URL_,Twitter for iPhone,FALSE,TRUE,"Professor, Physician-Scientist @hopkinsmedicine @hopkinsneph @JHUWelchCenter| Deputy Director @jhhealthequity|Sec @ASNKidney|:tennis: enthusiast|ally|Tweets=my views",30/10/2013 19:51,1,0,4,0,4969,3252,3329,51,"Baltimore, Maryland USA",FALSE,0,0
5344,30/08/2022 17:12,Biden Admin to Spend $11 Million on Monkeypox Vaccine Production - _URL_,Twitter Web App,FALSE,FALSE,"Desert Storm Vet, Independent,1A,2A, born Milwaukee,WI",05/08/2009 13:44,0,0,0,0,1062,972,117084,25,None,FALSE,0,0
6532,30/08/2022 15:58,"Bigger picture, note they are trying to use monkeypox as a mark of shame (even though untrue) 1) It's traditionally caught through any contact: direct, or towels, bedding, etc. 2) If through sex, so the hell what? But again that's a virus, his is bacterial. Get well soon. _URL_",Twitter for iPhone,FALSE,TRUE,":artist_palette: Artist, :nerd_face: Nerd, :hiking_boot: Vagabond. I believe in :teddy_bear: empathy & Carl Sagan's :globe_showing_Americas: Pale Blue Dot.",22/04/2009 02:22,0,0,0,0,161,161,11073,12,"Seattle, WA",FALSE,0,0
11608,30/08/2022 04:27,Black Men Less Likely to Get Monkeypox Vaccine _URL_,WordPress.com,FALSE,TRUE,Blogger and Writer,24/03/2021 01:14,0,0,0,0,290,3284,188416,2,Bangladesh,FALSE,0,0
7545,30/08/2022 14:56,"Black, Hispanic people disproportionately suffer monkeypox but fewer are getting the vaccine, early data shows _URL_",WordPress.com,FALSE,TRUE,_URL_ News media organization. India l Real news by Real people. Join us on editor@news89.com,17/08/2011 04:05,0,0,0,0,466,37,189104,31,"India, UAE, Kuwait, Qatar",FALSE,0,0
12461,30/08/2022 02:28,BREAKING First U.S. Monkeypox Death,Twitter Web App,FALSE,FALSE,Historian. I watch birds & squirrels. Copes with chronic illness & physical disability. Homebound. Kamala Harris 2024. COVID Reporter Since December 2019,16/10/2019 06:12,7,1,15,0,2141,3109,26283,6,Yooperland,FALSE,0,0
7559,30/08/2022 14:55,BREAKING: First death from #monkeypox in Texas confirmed in Harris County. _URL_,Twitter Web App,TRUE,TRUE,"San Antonio's source for breaking news, culture y más :rolled-up_newspaper:",31/10/2007 17:38,3,0,4,0,226707,6487,215508,1444,"San Antonio, Texas",FALSE,0,0
8033,30/08/2022 14:22,BREAKING: Texas' first monkeypox death confirmed out of Harris County _URL_,Sprout Social,TRUE,TRUE,":cityscape: DFW's most trusted source for news, weather, and traffic.  :vibration_mode: Always LIVE on the free @Audacy app",24/10/2008 15:22,0,0,0,0,41828,935,158852,939,"Dallas, TX",FALSE,0,0
7941,30/08/2022 14:29,Building Healthy Online Communities @BHOCpartners is in urgent need of support for their Monkeypox Vaccine Locator. They're looking for volunteers to help confirm and update information about community vaccine clinics. You can sign up to volunteer at: _URL_,TweetDeck Web App,TRUE,TRUE,"Disability justice, gender & racial equity, neurodiversity & trans liberation. Author @BeaconPressBks ""Sincerely, Your Autistic Child.""",26/10/2009 05:51,3,0,2,0,44617,10736,35562,831,Neurodiversity Is For Everyone,FALSE,0,0
11768,30/08/2022 04:00,Can Australia contain the monkeypox outbreak? | Australia news  #Health #HumanityAtStake #HumanHealth #monkeypox    _URL_ from @lauramoates,Buffer,FALSE,TRUE,"1/2 my posts will bore you. The other 1/2 will offend you. Writer, science nerd, egalitarian & animal lover.:middle_finger_medium_skin_tone:SJWs  I ONLY support LGBT:rainbow_flag: candidates:U.S._Outlying_Islands:",24/08/2008 12:06,0,0,0,0,6580,6059,311457,82,NYC,FALSE,0,0
10996,30/08/2022 06:41,Child Care Tips Symptoms Of Monkeypox Virus In Kids Know How To Prevent _URL_,WordPress.com,FALSE,TRUE,_URL_ is the leading news website cover 24/7 reporting. Facebook - _URL_,24/06/2022 06:15,0,0,0,0,19,13,16212,0,India,FALSE,0,0
5743,30/08/2022 16:43,CODX: Texas reports first U.S. death linked to monkeypox _URL_,WordPress.com,FALSE,TRUE,Financial News & Options Trades,22/09/2021 10:14,0,0,0,0,25,32,22266,0,Newsletter and other links:,FALSE,0,0
10444,30/08/2022 09:27,Development of the disease in marmot at the intranasal infection with the monkeypox virus _URL_,dlvr.it,FALSE,TRUE,Our digital literature delivery services utilize a worldwide network of libraries focusing on library-scanned PubMed and other life and earth sciences articles,12/02/2010 12:07,3,0,0,0,5100,192,850292,151,Tallinn,FALSE,0,0
4295,30/08/2022 18:21,FACT SHEET: White House Monkeypox Response Team Announces New Plans to Support Large LGBTQI+ Events and Equity Interventions to Reach Communities at Highest Risk of Contracting the Virus _URL_,WordPress.com,FALSE,TRUE,"StarsInfoCity is all about News, Entertainment, and Celebrity gossip.",11/02/2022 06:00,0,0,0,0,49,1,14057,0,None,FALSE,0,0
6312,30/08/2022 16:10,First death in US of person with monkeypox confirmed in Texas _URL_,WordPress.com,FALSE,TRUE,,01/09/2021 07:32,0,0,0,0,22,26,40170,0,None,FALSE,0,0
5772,30/08/2022 16:42,First death in US of person with monkeypox confirmed in Texas _URL_,WordPress.com,FALSE,TRUE,This Is Social Midea Reforming Digital Platform to expose the truth against and curruption and fight it,14/02/2022 11:37,0,0,0,0,97,50,75370,1,None,FALSE,0,0
2512,30/08/2022 20:25,First death of American with monkeypox reported in Texas; cause unknown _URL_,SocialFlow,TRUE,TRUE,"Health, science and environment news from The @WashingtonPost. Visit _URL_",09/09/2010 19:05,0,0,0,0,18661,857,22260,628,"Washington, D.C.",FALSE,0,0
1981,30/08/2022 21:00,First death of individual infected with #monkeypox in #Texas ...  | #monkeypoxvirus | #infection | #disease | #immunocompromised | Via @KXAN_News  _URL_,Buffer,FALSE,TRUE,"Tweeting and RT-ing microbiology news, articles and comments relevant to aspects on bacteria, fungi, viruses and other microbes / microorganisms. Microbes are :flexed_biceps:",12/04/2019 20:42,0,0,0,0,1458,516,42433,16,Earth,FALSE,0,0
6700,30/08/2022 15:48,First U.S. death of patient with monkeypox reported in Texas _URL_,WordPress.com,FALSE,TRUE,,01/09/2021 07:32,0,0,0,0,22,26,40170,0,None,FALSE,0,0
1329,30/08/2022 21:54,First US death linked to monkeypox reported in immunocompromised adult in Texas _URL_,IFTTT,FALSE,FALSE,"@arstechnica's RSS feed in your Twitter timeline. Title and link, no ICYMI. Not affiliated with Ars Technica.",30/04/2022 02:14,0,0,0,0,3,3,1292,0,None,FALSE,0,0
1142,30/08/2022 22:07,First US death linked to monkeypox reported in immunocompromised adult in Texas _URL_,WordPress.com,FALSE,TRUE,Blog On Tech Business Research Deveolpment,31/07/2022 13:08,0,0,0,0,28,43,972,1,None,FALSE,0,0
11033,30/08/2022 06:33,"For the ill-informed that want to run with some disinformation: Monkeypox is caused by a virus, not a bacteria. _URL_",Twitter Web App,FALSE,FALSE,"Disney and Star Trek geek, but not smart enough to know the trivia. and I'm OK with that. Love my dysfunctionally functional family. Voting blue since '92.",22/07/2009 22:21,0,0,1,0,194,24,17390,1,"Kauai, Hawaii",FALSE,0,0
3588,30/08/2022 19:09,"Fulton Co. has added evening monkeypox vaccination hours and set a vaccination clinic during Atlanta Black Pride from 10 am to 2 pm on Saturday, September 3, 2022 at the Neighborhood Union Health Center, 186 Sunset Ave NW # 186, Atlanta, GA 30314.",Twitter Web App,FALSE,TRUE,,05/03/2014 17:49,0,0,0,0,1258,943,23975,138,"Atlanta, GA",FALSE,0,0
1045,30/08/2022 22:17,"Georgia has 1,300 monkeypox cases: CDC _URL_",WordPress.com,FALSE,TRUE,"Oakland News Now Blog Pop-Culture Tech Social Media YouTube, Vlogging, Twitter, Blogging, movies, Hope Solo Fan #socialmedia #Oakland #blog #news #tech",15/10/2012 01:27,0,0,0,0,34,68,24215,6,"San Francisco, CA",FALSE,0,0
715,30/08/2022 22:46,"Good news: France, Germany, Portugal, Spain and Britain see a continued decline in #monkeypox cases.  Monkeypox outbreak can be eliminated in Europe, WHO says | CBC News _URL_",Twitter Web App,FALSE,FALSE,":Canada: :maple_leaf:Retired paralegal judicial clerk, critical thinker, singer, pro-science, pro-law & order, pro-T&R, anti-facist, anti-racist humanist :peace_symbol: :feather: :rainbow: :transgender_symbol:",19/05/2008 20:25,2,0,2,0,5410,3761,168910,170,Snuneymuxw territory,FALSE,0,0
1984,30/08/2022 21:00,"Gov. Edwards, White House discuss Monkeypox response _URL_",SocialFlow,TRUE,TRUE,NBC 6 is Your Weather Authority,01/09/2009 13:25,0,0,0,0,12716,559,96676,317,"Shreveport, LA",FALSE,0,0
9295,30/08/2022 12:41,GUYANA CONFIRMS SECOND MONKEY POX CASE _URL_,WordPress.com,FALSE,FALSE,,29/01/2011 17:04,0,0,0,0,14,105,4148,0,London,FALSE,0,0
10823,30/08/2022 07:27,"Harris County resident who was presumed positive for monkeypox dies; cause of death has not been released, officials say _URL_",WordPress.com,FALSE,TRUE,check my site If you are interested in fitness.,25/10/2019 00:26,0,0,0,0,63,87,150942,2,None,FALSE,0,0
10682,30/08/2022 08:17,"Harris County resident who was presumptive positive for monkeypox dies; cause of death not released, officials say _URL_",WordPress.com,FALSE,TRUE,_URL_ for latest news,16/07/2022 06:02,0,0,0,0,1,0,3276,0,None,FALSE,0,0
10764,30/08/2022 07:47,"Harris County resident who was presumptive positive for monkeypox dies; cause of death not released, officials say _URL_",WordPress.com,FALSE,FALSE,,18/07/2022 10:22,0,0,0,0,1,3,5915,0,None,FALSE,0,0
3248,30/08/2022 19:33,"Health officials in Texas announced Monday they are investigating what role monkeypox played in the death of a patient who was diagnosed with the virus. State officials said in a statement that the adult patient was ""severely immunocompromised."" _URL_",Twitter for iPhone,FALSE,TRUE,Watch our latest episode of The US Armenian of the Month Series in our Youtube Channel. #theusarmenians,06/04/2020 20:45,0,0,1,0,1152,388,1958,2,"Los Angeles, CA",FALSE,0,0
4418,30/08/2022 18:14,HHS Start monkeypox equity program for LGBTQ people of color @JackPosobiec @Timcast @DrewHLive _URL_,Twitter for Android,FALSE,FALSE,,02/04/2020 17:04,0,0,0,0,141,144,54930,0,None,FALSE,0,0
9232,30/08/2022 12:48,"HOUSTON, Texas (KTRK) -- An adult hospitalized with various severe illnesses as well as a presumptive positive monkeypox case has died, Harris County officials said on Monday. _URL_",Twitter Web App,FALSE,FALSE,,02/03/2020 19:04,4,1,7,0,876,1388,76447,9,Nashville,FALSE,0,0
7703,30/08/2022 14:46,If you suspect you might have been in contact with someone infected with monkeypox you should get tested. You can still receive the vaccine within 4 days of your last exposure. #ScienceUpFirst :thread:[5/7],Twitter Web App,TRUE,TRUE,"FR : @LaScienceDAbord Researchers, health care experts & communicators sharing good science to stop misinformation. #ScienceUpFirst / #LaSciencedAbord",08/12/2020 18:46,0,1,1,0,23337,203,2722,196,None,FALSE,0,0
