number,created_at,text,source,user is verified,user has url,user description,user created at,retweet_count,reply_count,like_count,quote_count,followers count,following count,tweet count,listed_count,user location,beto_flag,binary_class,ternary_class
6825,30/08/2022 15:40,Texas reports first death of person with monkeypox in U.S. _URL_,Twitter Web App,TRUE,TRUE,"Smart Brevity worthy of people's time, attention and trust. Subscribe to our newsletters: _URL_",21/11/2016 14:28,15,7,28,1,648128,1009,120010,8558,None,FALSE,0,0
3370,30/08/2022 19:24,Texas reports first death of person with monkeypox in U.S. _URL_,Twitter for iPhone,FALSE,FALSE,Never change self to please anyone.,10/08/2021 20:42,0,0,0,0,57,217,7071,1,None,FALSE,0,0
1712,30/08/2022 21:22,Texas reports first U.S. death in person with monkeypox _URL_,Microsoft Power Platform,FALSE,FALSE,"Fair, Liberal, Pro Choice. The truth is worth it.",31/05/2017 15:19,0,0,0,0,26,71,55857,3,"Texas, USA",FALSE,0,0
2120,30/08/2022 20:50,Texas Reports Nation's First Possible Death From Monkeypox _URL_,WordPress.com,FALSE,TRUE,Global News,05/11/2020 00:28,0,0,0,0,16,113,18342,0,None,FALSE,0,0
4226,30/08/2022 18:27,Texas reports what may be the first U.S. death from monkeypox _URL_,WordPress.com,FALSE,FALSE,Alone,10/08/2022 01:48,0,0,0,0,2,11,4780,0,None,FALSE,0,0
3427,30/08/2022 19:19,Texas reports what may be the first U.S. death from monkeypox _URL_,WordPress.com,FALSE,TRUE,"UgoNew is a free online service that allows you to read, search and watch the latest news from multiple sources.",15/07/2022 12:19,0,0,0,0,1,49,6531,0,None,FALSE,0,0
5068,30/08/2022 17:32,Texas reports what may be the first U.S. death from monkeypox _URL_,WordPress.com,FALSE,TRUE,"Global News Live is a leading news website that covers global news. We cover politics, sports, technology, world news, health and entertainment and many more.",08/02/2020 03:32,0,0,0,0,29,0,57967,0,World,FALSE,0,0
4534,30/08/2022 18:06,Texas reports what may be the first U.S. death from monkeypox _URL_,Twitter Web App,FALSE,TRUE,My personal tweet account; Information Technology Professional; Occasional Photographer & Hi-Fi Enthusiast; Nothing is an endorsement- only information sharing.,16/10/2013 22:39,0,0,0,0,231,4991,64024,3,"Chicago, Illinois",FALSE,0,0
1760,30/08/2022 21:18,Texas reports what may be the first U.S. death from monkeypox #MonkeypoxVirus #ImmunoCompromised _URL_,Twitter Web App,FALSE,TRUE,Platform at the intersection of bioinformatics and synthetic chemistry. Founder @Margaret_Linan Visit the YouTube Channel: _URL_,09/10/2021 03:30,0,0,0,0,22,306,526,0,None,FALSE,0,0
5342,30/08/2022 17:12,Texas reports what may be the first US death from monkeypox _URL_,WordPress.com,FALSE,TRUE,check my site If you are interested in fitness.,25/10/2019 00:26,0,0,0,0,63,87,150942,2,None,FALSE,0,0
4643,30/08/2022 18:00,Texas reports what might be the very first U.S. death from monkeypox - #BiotechandPharmaceuticals #Biotechnology #BreakingNews:Business #businessnews #Healthcareindustry #Monkeypox #Texas - #Investment #BTC #Crypto #Metaverse #Web3 #cryptonews #news #blockchain #ecosystem _URL_,cryptopylon,FALSE,TRUE,We Are Independent Global Crypto News Website.,24/04/2022 10:57,0,2,1,0,33,27,3384,3,None,FALSE,0,0
3557,30/08/2022 19:11,Texas' first monkeypox death reported in Harris County _URL_,Twitter Web App,FALSE,FALSE,,03/11/2020 23:53,1,0,1,0,184,612,39372,3,None,FALSE,0,0
7528,30/08/2022 14:57,Texas' first monkeypox death reported in Harris County _URL_,Twitter for iPhone,FALSE,FALSE,"HR Savvy, Change-Agent, People Champion, Yogi, morphing into a social butterfly connecting with like minded professionals. Human Experience Evangelist by day.",29/03/2017 04:30,0,0,0,0,1653,1485,8612,15,"Houston, TX",FALSE,0,0
9550,30/08/2022 12:05,The Biden administration signed an $11 million deal to support a Michigan company that's helping make vaccine against monkeypox _URL_,Twitter for iPhone,FALSE,FALSE,NYS Legislative Attorney | Clinical Ethicist | Views expressed or implied are my own | :rainbow_flag: he/él,08/07/2021 11:04,0,0,0,0,301,2483,1205,4,"Albany, NY | b. PR :Puerto_Rico:",FALSE,0,0
10908,30/08/2022 07:02,"The Biden administration signed an $11 million deal to support a Michigan company that's helping make vaccine against monkeypox, another move to bolster prevention of the quickly spreading virus. ...1/2) _URL_",Twitter Web App,FALSE,TRUE,Husbandยิ่งลักษณ์:red_heart:&สุภาพร:red_heart: Commander of the South China Sea Department of Research of the Asia Pacific Marine Corps Semper Fidelis _URL_,22/02/2022 04:01,0,1,1,0,76,390,9035,3,Asia-Pacific,FALSE,0,0
8637,30/08/2022 13:40,"The decline in monkeypox infections across Europe shows that the virus can be controlled or even eliminated despite a vaccine supply shortage, the WHO says _URL_",SocialFlow,TRUE,TRUE,The first word in business news.,23/04/2009 20:05,9,5,28,2,8591044,1421,835269,67860,New York and the World,FALSE,0,0
13104,30/08/2022 00:55,"The monkeypox virus may cause intense pain but the psychological scars of the illness can be just as devastating, say sufferers and those who are treating them. _URL_",TweetDeck,TRUE,TRUE,"The official digital arm of the STAR Group of Publications. We provide credible breaking news, in-depth reports, fact-checks, and contextual real-time coverage.",09/07/2009 02:48,1,0,2,1,939600,133,341097,2578,"Manila, Philippines",FALSE,0,0
12619,30/08/2022 02:05,The monkeypox virus may cause intense pain but the psychological scars of the illness can be just as devastating. | vvia @philstarlife _URL_,TweetDeck,TRUE,TRUE,"The official Twitter account of The Philippine STAR, flagship title of the country's most successful print media enterprise.",23/01/2012 16:37,1,0,5,0,1373612,861,604657,2323,Philippines,FALSE,0,0
7455,30/08/2022 15:01,"The sooner a person exposed to #monkeypox can get vaccinated, the better the outcome. Receiving a monkeypox vaccine within four days of being exposed can provide the best chance of prevention. _URL_ _URL_",Hootsuite Inc.,TRUE,TRUE,The Houston Health Department is accredited by the Public Health Accreditation Board and serves the diverse communities of Houston.,02/05/2009 22:55,0,0,0,0,40646,3475,17263,545,"Houston, TX",FALSE,0,0
7992,30/08/2022 14:26,The Texas Department of State Health Services has confirmed the first death of a person diagnosed with monkeypox in Texas. _URL_,SocialNewsDesk,TRUE,TRUE,"The South Plains most watched news, weather and sports. KCBD-TV, NBC Affiliate in Lubbock, TX.",25/01/2010 15:24,0,0,0,0,25870,250,120085,364,"Lubbock, TX",FALSE,0,0
7348,30/08/2022 15:08,"The World Health Organization (WHO) said Tuesday it saw ""encouraging"" signs the #monkeypox epidemic was slowing in #Europe and heading ""in the right direction"", calling on countries to double down on efforts  _URL_",Twitter Web App,FALSE,TRUE,A business daily from Bangladesh,02/04/2021 09:33,0,0,0,0,37,115,3700,0,Dhaka,FALSE,0,0
5019,30/08/2022 17:35,There are still spots left in the Allentown Health Bureau's monkeypox vaccine clinic this Thursday from 4-6pm! You can schedule an appointment by calling 610-437-7760 ext. 0. Learn more about monkeypox and local resources available to you at _URL_ _URL_,Twitter Web App,TRUE,TRUE,Proud to represent Pennsylvania's 7th Congressional District,03/12/2018 16:57,4,2,7,0,16242,1057,3928,549,United States,FALSE,0,0
2840,30/08/2022 20:04,"There were no deaths among monkeypox patients who had a smallpox vaccination scar. But among the 250 who did not, there were 27 fatal cases. All the deaths occurred in children under 8, &amp; case fatality rate was &gt;2X as high among those 4 years of age and younger than among 5 to 9. _URL_",Twitter Web App,FALSE,TRUE,"Betty C. Jung MPH RN MCHES:registered: Adjunct lecturer, Public Health; PHENOM Director; Webmaster #PublicHealth #Health #Science #Technology #Culture #COVID19",01/03/2010 19:12,0,0,0,1,1063,190,212562,391,United States,FALSE,0,0
12514,30/08/2022 02:19,"This case in Harris County, Texas may represent the first #monkeypox death in the #UnitedStates.  #MedTwitter #Texas #USA _URL_ _URL_",Twitter for iPad,FALSE,FALSE,"Physician and Volunteer Teacher Univ of Oklahoma, Gulf War Veteran with the Army 445th Military Police Company, Eagle Scout, Farm boy from Wilburton, Oklahoma",27/04/2020 22:59,3,2,10,0,6020,1229,5713,62,None,FALSE,0,0
7444,30/08/2022 15:02,"This seems important:  ""It is the first person to die in the U.S. with an active monkeypox infection, with an autopsy now underway to confirm exact cause of death""",Twitter for Android,FALSE,FALSE,This is not what I ordered,16/12/2020 16:51,0,1,6,0,289,689,2246,0,"Los Clowngeles, Clownifornia",FALSE,0,0
8074,30/08/2022 14:19,"This Thursday, September 1, 2022, from 12:30 p.m. to 1:30 p.m, my office is co-hosting a Virtual Chat &amp; Chew Session to share important info about COVID-19 and the Monkeypox virus. Sign up here: _URL_ _URL_",Twitter Web App,FALSE,FALSE,"Official government account for @RitaJosephNYC. Proudly representing District 40: Flatbush, Kensington, Ditmas Park, PLG, & Crown Heights. DMs are open!",03/03/2022 19:24,0,0,0,0,229,8,193,5,None,FALSE,0,0
5536,30/08/2022 17:00,Tune in at 2 PM ET for a press briefing on our monkeypox response and our efforts to get more vaccines manufactured and distributed. _URL_,Sprinklr Publishing,TRUE,TRUE,Dad. Husband. 25th Secretary of @HHSGov. Secretario de Salud y Servicios Humanos. Defeating COVID-19 and expanding access to health care with @POTUS and @VP.,18/03/2021 16:17,17,4,25,6,32953,73,1243,620,"Washington, D.C.",FALSE,0,0
4909,30/08/2022 17:42,TX Officials Confirm The First Death Of Monkeypox In The State _URL_,WordPress.com,FALSE,FALSE,,31/07/2022 00:32,0,0,0,0,5,32,2014,0,None,FALSE,0,0
9079,30/08/2022 13:02,U.S. data reveals racial gaps in monkeypox vaccinations _URL_ via @AP,TweetDeck,FALSE,TRUE,"New York Health Foundation is a private statewide foundation dedicated to improving health. Consumer empowerment, healthy food, veterans' health.",17/02/2010 15:30,0,0,0,0,7132,2715,33126,260,New York,FALSE,0,0
7459,30/08/2022 15:01,"U.S. Monkeypox Cases Cross 18,000 _URL_ _URL_ _URL_",dlvr.it,FALSE,TRUE,"Bitcoin, Forex and Stock Market Headline News, Price Charts and Trade Ideas - Trading Strategies _URL_",21/06/2019 10:45,1,0,1,0,809,517,113015,17,Trading Strategies,FALSE,0,0
1886,30/08/2022 21:09,US records first death linked to monkeypox — RT World News _URL_,Twitter Web App,FALSE,FALSE,,10/10/2010 12:06,0,0,0,0,844,4961,1284974,98,None,FALSE,0,0
4964,30/08/2022 17:39,US reports 1st monkeypox-related fatality  _URL_ #KUNA,Hootsuite Inc.,TRUE,TRUE,Kuwait News Agency (KUNA) Official site A Comprehensive News Service Arabic @Kuna_ar Français @Kuna__fr,21/02/2011 11:56,1,0,0,0,95271,2,108018,531,"Al Shuwaikh, Kuwait Tel +965 22271800",FALSE,0,0
579,30/08/2022 23:00,US reports first death linked to monkeypox,closefeed bot,FALSE,TRUE,Posting the news every hour. Main account @closefeed,19/06/2021 17:42,0,1,0,0,18,16,2327,0,Nigeria,FALSE,0,0
673,30/08/2022 22:50,US reports first death linked to monkeypox _URL_,Echobox,TRUE,TRUE,"This is the official Twitter handle of PUNCH Newspapers, the most widely read newspaper in Nigeria.",14/03/2009 00:27,11,8,43,0,5611856,2189,540393,3356,"Lagos, Nigeria",FALSE,0,0
895,30/08/2022 22:29,US reports first death linked to monkeypox _URL_,WordPress.com,FALSE,FALSE,Amanda1999,31/05/2022 15:48,0,0,0,0,3,1,3612,0,None,FALSE,0,0
457,30/08/2022 23:13,US reports first death linked to monkeypox _URL_,WordPress.com,FALSE,FALSE,Andini1992,31/05/2022 15:53,0,0,0,0,3,1,4943,0,None,FALSE,0,0
467,30/08/2022 23:11,US reports first death linked to monkeypox _URL_,WordPress.com,FALSE,FALSE,Andini1992,31/05/2022 15:53,0,0,0,0,3,1,4943,0,None,FALSE,0,0
12794,30/08/2022 01:35,"US reports more than 17,000 cases of monkeypox _URL_ #COVID19 #LosAngeles #Monkeypox #NewYork",dlvr.it,TRUE,TRUE,_URL_ is one stop source for Telugu News from Andhra Pradesh / Telangana & Around World.Please follow TeluguStop Media & Stay Tuned info@telugustop.com,14/11/2012 05:59,0,0,0,0,50372,800,169514,14,India,FALSE,0,0
12513,30/08/2022 02:19,"US reports over 17,000 monkeypox cases _URL_",WordPress.com,FALSE,TRUE,Daily News Paper,07/06/2021 06:57,0,0,0,0,67,26,6708,0,"Surat, India",FALSE,0,0
5868,30/08/2022 16:35,WATCH LIVE: White House Monkeypox Response Team holds news briefing _URL_,Twitter Web App,FALSE,FALSE,,22/02/2009 17:05,0,0,0,0,33,54,145244,0,None,FALSE,0,0
8579,30/08/2022 13:44,"We continue to monitor the spread of #monkeypox (MPX) in our community. While the risk to the general public remains LOW, steps can be taken to prevent transmission. For more information on MPX and vaccine eligibility, visit our MPX page below LINK _URL_ _URL_",Twitter Web App,TRUE,TRUE,"Our mission is to protect, promote, and improve the health of all people in Hillsborough County through integrated state, county, and community efforts.",09/05/2017 18:28,0,1,1,0,2386,740,6842,27,"Tampa, FL",FALSE,0,0
29,30/08/2022 23:56,We have decided to push back till the 19th of Sept. Please retweet. Thx #school #BackToSchool #BackToSWSchool #backtoschoolsale #virtuallearning #onlineschool #teacher #teachers #teaching #kids #learning #covid #CovidIsNotOver #covid19 #monkeypox _URL_,Twitter for iPhone,FALSE,FALSE,A human,23/04/2013 20:48,1,0,3,1,11759,12926,14076,35,None,FALSE,0,0
3655,30/08/2022 19:04,"We'll be allocating an additional supply of thousands of JYNNEOS vials to the Southern Decadence festival in New Orleans, the Black Pride festival in Atlanta, and to two festivals in Oakland, the Pride festival &amp; PrideFest, so more people can get vaccinated against monkeypox.",Sprinklr Publishing,TRUE,TRUE,Dad. Husband. 25th Secretary of @HHSGov. Secretario de Salud y Servicios Humanos. Defeating COVID-19 and expanding access to health care with @POTUS and @VP.,18/03/2021 16:17,4,3,18,0,32953,73,1243,620,"Washington, D.C.",FALSE,0,0
10368,30/08/2022 09:51,What you need to know about #monkeypox from @WHO _URL_,Twitter for iPhone,FALSE,TRUE,"Technical officer (Public Health Laboratories), WHE, World Health Organisation, Country office for Nepal. Tweeting in personal capacity.",24/05/2014 04:55,4,2,12,0,1461,1037,5158,19,Nepal,FALSE,0,0
6527,30/08/2022 15:58,"WHO: Monkeypox Cases Drop 21%, Reversing Month-Long Increase _URL_ _URL_",Twitter Web App,FALSE,TRUE,be the first people now about what is happening in the world of finance and Business and news just by visiting ower websites:_URL_,23/07/2022 22:33,0,0,0,0,0,74,73,0,Canada,FALSE,0,0
7707,30/08/2022 14:46,"Who's at risk of catching Monkeypox? Anyone can be affected, regardless of sex, religion, race, gender or sexual orientation.   #ScienceUpFirst :thread:[2/7]",Twitter Web App,TRUE,TRUE,"FR : @LaScienceDAbord Researchers, health care experts & communicators sharing good science to stop misinformation. #ScienceUpFirst / #LaSciencedAbord",08/12/2020 18:46,0,1,3,0,23337,203,2722,196,None,FALSE,0,0
4980,30/08/2022 17:37,"With enough monkeypox vaccine finally in hand, US seeks to make more shots at home _URL_",Twitter Web App,FALSE,FALSE,"News Junkie, Passionate, Huge Heart! Independent. Living by example. Always grateful...",16/11/2012 16:45,1,0,0,0,275,881,107685,2,"Georgia, USA",FALSE,0,0
9917,30/08/2022 11:20,Work on monkeypox messaging forces Colorado officials to confront past mistakes of public health _URL_,WordPress.com,FALSE,TRUE,The Goose is a News & Media company that aims to bring only the best & truthful content to our users from around the globe.,21/01/2022 18:52,0,0,0,0,352,385,2952,9,None,FALSE,0,0
9333,30/08/2022 12:37,World Health Organization says there are encouraging signs of a sustained week-on-week decline in the onset of cases in many European countries _URL_,Twitter Web App,TRUE,TRUE,RTÉ News and Current Affairs - Irish and International News,19/09/2007 12:52,2,8,10,0,1146024,311,212083,4107,Ireland,FALSE,0,0
2422,30/08/2022 20:29,"@ACLU Over 2 million Illegals are coming into our country every year. Many are NOT vaccinated &amp; can spread a variety of communicable diseases including: TB, COVID, polio, monkey pox, measles, encephalitis, etc. Thank you, Joe Biden!",Twitter Web App,FALSE,FALSE,,09/06/2022 19:22,0,0,0,0,1,1,7849,1,None,FALSE,1,1
9551,30/08/2022 12:05,"@AliBradleyTV Would that constitute just walking across the border? What are they bringing with them, COVID-19, Monkey Pox, drugs, assaults, murder, terrorism, rape? Should the President be impeached for failure to faithfully execute his his duties as President?",Twitter for Android,FALSE,FALSE,"Just a simple guy, not the sharpest knife in the drawer. I have been to war, some may hear of the Tet Offensive. been there, done that. I am not naive about war",31/05/2021 13:02,0,0,0,0,40,35,1006,0,None,FALSE,1,1
1691,30/08/2022 21:24,@bacceculo @SerbiaBased sounds like the monkeypox and other associated STD's you carry have gone to your brain….,Twitter for iPhone,FALSE,FALSE,,13/01/2018 12:10,0,1,0,0,17,35,815,0,None,FALSE,1,1
2855,30/08/2022 20:03,@BerkshireGirl71 @TrumpTower lookit all the bots and shills coming out of the woodwork bc beto has monkeypox,Twitter Web App,FALSE,FALSE,Sic Semper Tyrannis  #pureblood genX--we are the bag holding generation our revenge is to watch the world burn,26/06/2009 00:53,0,0,0,0,2135,3172,35581,1,None,TRUE,1,1
2561,30/08/2022 20:22,"@BetoORourke Bacterial infection is just codeword for Monkeypox. Considering Beto is openly gay, it's not a far stretch to think so.",Twitter for iPhone,FALSE,FALSE,Ayy it's Big John,01/05/2017 12:29,0,0,0,0,211,191,986,0,None,TRUE,1,1
12143,30/08/2022 03:17,@BetoORourke beta has the monkeypox now? _URL_,Twitter for iPhone,FALSE,TRUE,"""Our true enemy…has yet…to reveal himself.""",26/12/2014 15:31,1,1,2,0,105,142,7010,0,"St. Louis, Missouri",TRUE,1,1
5553,30/08/2022 16:58,@BetoORourke Beto has monkeypox. #BetoHasMonkeyPox,Twitter for iPhone,FALSE,FALSE,"""Living well is the best revenge."" - George Herbert",18/10/2021 17:32,0,0,0,0,24,109,5852,3,Los Angeles,TRUE,1,1
3596,30/08/2022 19:08,@BetoORourke Go put Neosporin on your Monkey Pox soars....,Twitter Web App,FALSE,TRUE,"Providing core drilling, flat/hand sawing, joint sealing and floor polishing.",15/09/2014 05:54,0,0,0,0,206,313,610,2,"Chesapeake, VA",TRUE,1,1
8537,30/08/2022 13:46,"@BetoORourke HAHAHAHAHAHAHAHA Got that Monkeypox yelling into contaminated cocks huh Beto, could not of happened to a better fella.",Twitter for iPhone,FALSE,FALSE,"Northeastern Nobody, Mafucka I'm on break:nail_polish_medium-dark_skin_tone: Tolerance was never meant to be submission:black_heart:",16/02/2022 04:25,0,0,1,0,389,359,10608,0,None,TRUE,1,1
2351,30/08/2022 20:33,@BetoORourke How's that case of Monkeypox working out for you?,Twitter for iPhone,FALSE,FALSE,American,09/08/2022 00:10,0,0,0,0,4,49,267,0,None,TRUE,1,1
3790,30/08/2022 18:54,@BetoORourke How's that monkey pox going??,Twitter for Android,FALSE,FALSE,"RN, BSN, HM2 Corpsman",22/06/2022 18:15,0,0,0,0,92,204,1573,0,Texas Is My Jam,TRUE,1,1
3213,30/08/2022 19:35,@BetoORourke How's that monkeypox going? Do you have those bubbles all around your mouth?,Twitter for Android,FALSE,FALSE,Chillbilly. Born Arkansas. Michigan boy now. Desert Storm Veteran. Nov Scorpio. NO DM's,26/05/2021 11:22,0,0,0,0,286,1357,5772,0,None,TRUE,1,1
46,30/08/2022 23:52,@BetoORourke How's the monkeypox clearing up?,Twitter for iPhone,FALSE,FALSE,Striving for mediocrity.,26/04/2022 22:45,0,0,0,0,14,42,1286,1,None,TRUE,1,1
1911,30/08/2022 21:07,"@BetoORourke Is it Monkeypox? Be careful, I've heard the Bible warns not to lay with a man. Basically, He's warning that even if you are a Deviant, don't let your boyfriend violate your rectum!",Twitter for Android,FALSE,FALSE,Never cater to the undesirable. #ultramaga,04/11/2021 18:57,0,0,0,0,2,57,587,0,None,TRUE,1,1
382,30/08/2022 23:20,@BetoORourke Is it true you have monkey pox in your butt? If so we are so sad.,Twitter Web App,FALSE,FALSE,,18/06/2022 22:00,0,0,0,0,61,348,3652,0,None,TRUE,1,1
1134,30/08/2022 22:08,"@BetoORourke So, your MonkeyPox is better?",Twitter for iPhone,FALSE,TRUE,Uncensored Conservative news aggregation. Follow us for breaking news.,13/05/2021 20:12,0,0,0,0,209,565,50604,2,"Dallas, TX",TRUE,1,1
8737,30/08/2022 13:33,@BuzzoDr @realMarkHobart Up until this shit fight I'd never been asked to show a vaccine verification for any job. So you stick to your big pharma slave mentality and jab yourself silly. Monkey pox Vax for you next I guess.:winking_face:,Twitter for Android,FALSE,FALSE,,21/06/2017 12:46,0,0,2,0,53,64,2468,0,"Western Australia, Australia",FALSE,1,1
6454,30/08/2022 16:02,@catturd2 Last Sunday Arthel Neville had some doctor on her FOX News show pushing both the new COVID booster and the monkeypox vaccine. It's funny how they can create vaccines out of thin air these days when it used to take years if not decades.,Twitter Web App,FALSE,FALSE,"Ugly old man in the little boat. NRA member, Pro constitution and pro life conservative.  #FJoeBiden",05/04/2017 21:53,2,0,4,0,20744,20897,67399,7,"Wisconsin, USA",FALSE,1,1
2687,30/08/2022 20:15,"@CNNPolitics Over 2 million Illegals are coming into our country every year. Many are NOT vaccinated &amp; can spread a variety of communicable diseases including: TB, COVID, polio, monkey pox, measles, encephalitis, etc. Thank you, Joe Biden!",Twitter Web App,FALSE,FALSE,,09/06/2022 19:22,0,0,0,0,1,1,7849,1,None,FALSE,1,1
11663,30/08/2022 04:17,"@D14951351 Considering this didn't come out in 2020, a few months into fearmongering19, but came out as the poison darts were being released, is pretty telling imo...and continues to 2025? We know more is coming; always have. Monkeypox, smallpox, SPARS, Marburg are all in the queue.",Twitter for Android,FALSE,FALSE,"In a time of universal deceit, telling the truth is a revolutionary act. -GeorgeOrwell",13/04/2020 22:22,0,0,0,0,1733,1951,6106,0,"B.C., Canada",FALSE,1,1
4738,30/08/2022 17:55,@dimebagden Monkey Pox is an STD!,Twitter for iPad,FALSE,FALSE,,23/06/2022 03:40,0,0,0,0,14,60,1056,0,None,FALSE,1,1
13429,30/08/2022 00:14,@DineshDSouza Don't worry Beto-maniacs...monkey Pox usually isn't fatal. Though I do wonder how he got it!,Twitter Web App,FALSE,FALSE,My main passion is my record collection. Try to keep myself educated about what is happening in our country! No DMs please! You will be blocked!,29/07/2022 00:24,0,0,0,0,25,121,1273,1,"Mansfield, MA",TRUE,1,1
12213,30/08/2022 03:06,@evcoop95 @somajoe69 @MarkDeezy25 @Stephen78227862 @DineshDSouza Did you get your Monkeypox Vax yet? Maybe an ass diaper? 2 weeks to slow the spread. Stay away from kids,Twitter for iPhone,FALSE,FALSE,"Super fast, Super efficient, Superstraight painter",08/03/2021 23:35,0,0,0,0,20,150,1318,0,None,FALSE,1,1
709,30/08/2022 22:46,"@EynoufElizabeth Yes, Monkey Pox, HIV &amp; Genital Herpes are Viral infections.  Beto O'Rourke has Bacterial infection like Syphilis, Gonorrhea or Chlamydia. Democrat politicians must be cautious as any of these diseases could be contracted easily at a well-attended Democrat Fundraiser/Gay Orgy",Twitter Web App,FALSE,FALSE,Patriot;Common Sense Conservative; Supporter of US Constitution & Military; Believe in American Dream; A Hand Up Better Than A Hand Out; Been Around-Done A Lot!,23/09/2012 13:22,1,0,1,0,3696,4172,97251,45,USA,TRUE,1,1
1663,30/08/2022 21:25,@FoxNews Well I heard monkeypox goes in through the out door so..,Twitter Web App,FALSE,FALSE,From Mars  火星から,25/04/2022 20:32,1,1,9,0,55,150,3163,4,Mars,FALSE,1,1
391,30/08/2022 23:20,"@Genesius_Times @AaronWorthing @JackPosobiec How did Beto contract monkeypox, then? :thinking_face:",Twitter for iPhone,FALSE,TRUE,"The Greater Oakland Republican Club of Oakland County, Michigan. An icon of free choice.",26/02/2009 20:55,0,0,1,0,310,1040,40051,2,"Northern Oakland County, MI",TRUE,1,1
3397,30/08/2022 19:21,"@ilovedonrickles I loved his press conference on monkey pox. ""For the next 30 days, please try to maybe refrain from multiple partners and anonymous sex if you potentially possibly can. If you are up for it.""",Twitter Web App,FALSE,TRUE,"1st generation American. Married with 2 sons. Alum of: Lane Tech, UIC, DePaul, Irving Park News, Midwest Iron Works, Zenith Radio, Kraft Foods",21/08/2014 21:10,0,0,1,0,3,38,522,0,Witness Protection Program,FALSE,1,1
6603,30/08/2022 15:54,"@ivery5000 @ReutersFacts Monkeypox Beto is a far-Left  anti-1st Amendment, anti-2nd Amendment, pro-Open Border, globalist Communist. He'll never win in Texas. Maybe California, but never Texas. #MonkeypoxBeto:monkey_face::microbe:",Twitter Web App,FALSE,FALSE,2A makes 1A possible. :United_States::United_States::United_States:,29/08/2022 13:21,0,0,0,0,15,198,418,2,Texas,TRUE,1,1
12955,30/08/2022 01:16,"@JackPosobiec After eating random ass in an Austin, TX bathhouse…….@BetoORourke has contracted #monkeypox :microbe: _URL_",Twitter for iPhone,FALSE,FALSE,Libertarian. Army Vet. Republican. African American. Proud to be an American :United_States: Resist communism in America. Resist globalization. Stand with the Constitution,15/08/2021 02:21,1,0,3,0,796,620,13185,13,The Free State of Florida:palm_tree::sun_with_face:,TRUE,1,1
6620,30/08/2022 15:53,@JackPosobiec Beto probably caught Monkey Pox,Twitter for iPhone,FALSE,FALSE,,15/01/2014 20:08,0,0,0,0,5,23,64,0,None,TRUE,1,1
11920,30/08/2022 03:42,@JackPosobiec He got the monkey pox and knows getting an infection from getting gangbanged at an orgy probably would cost him quite the number of votes,Twitter for Android,FALSE,FALSE,"coffin :coffin: maker, Gamer, huge @BethesdaStudios and @Xbox Fan (#ElderScrolls & #Fallout Obsessed) love all tech, history and documentaries aka WarHammerWineholt",23/09/2020 13:26,0,0,0,0,691,3494,25075,1,"York, PA",FALSE,1,1
